UC1 : Create database

mysql> create database address_book;
Query OK, 1 row affected (0.02 sec)

mysql> show databases;
+--------------------+
| Database           |
+--------------------+
| address_book       |
| information_schema |
| mysql              |
| payroll_service    |
| performance_schema |
| sys                |
+--------------------+
6 rows in set (0.04 sec)

mysql> use address_book;
Database changed

----------------------------------------------------------------------------------------
UC2 : Create address book table and add columns

mysql> CREATE TABLE AddressBook (
    ->     id INT AUTO_INCREMENT PRIMARY KEY,
    ->     first_name VARCHAR(20) NOT NULL,
    ->     last_name VARCHAR(20) NOT NULL,
    ->     address VARCHAR(100),
    ->     city VARCHAR(20),
    ->     state VARCHAR(20),
    ->     zip VARCHAR(10),
    ->     phone_number VARCHAR(15),
    ->     email VARCHAR(20)
    -> );
Query OK, 0 rows affected (0.05 sec)

mysql> describe AddressBook;
+--------------+--------------+------+-----+---------+----------------+
| Field        | Type         | Null | Key | Default | Extra          |
+--------------+--------------+------+-----+---------+----------------+
| id           | int          | NO   | PRI | NULL    | auto_increment |
| first_name   | varchar(20)  | NO   |     | NULL    |                |
| last_name    | varchar(20)  | NO   |     | NULL    |                |
| address      | varchar(100) | YES  |     | NULL    |                |
| city         | varchar(20)  | YES  |     | NULL    |                |
| state        | varchar(20)  | YES  |     | NULL    |                |
| zip          | varchar(10)  | YES  |     | NULL    |                |
| phone_number | varchar(15)  | YES  |     | NULL    |                |
| email        | varchar(20)  | YES  |     | NULL    |                |
+--------------+--------------+------+-----+---------+----------------+
9 rows in set (0.02 sec)

----------------------------------------------------------------------------------------
UC3 : Insert new contacts to address book

mysql> INSERT INTO AddressBook (first_name, last_name, address, city, state, zip, phone_number, email)
    -> VALUES ('Harshal', 'Gotarne', 'Anik Village, Chembur', 'Mumbai', 'Maharashtra', '400074', '8433878127', 'harshalgotarne25@gmail.com');
Query OK, 1 row affected (0.01 sec)

mysql> INSERT INTO AddressBook (first_name, last_name, address, city, state, zip, phone_number, email)
    -> VALUES
    -> ('Nitish', 'Prajapati', 'Sector 21', 'Ulve', 'Maharashtra', '410216', '7652079588', 'nitishprajapati@gmail.com'),
    -> ('Gaurav', 'Dhande', 'Jay ashtavinyak building', 'Dombivali', 'Maharashtra', '421202', '7977139767', 'gauravdhande@gmail.com'),
    -> ('Anjali', 'Patel', '23 Marine Drive', 'Mumbai', 'Maharashtra', '400020', '02267890123', 'anjali.patel@example.com');
Query OK, 3 rows affected (0.01 sec)
Records: 3  Duplicates: 0  Warnings: 0

mysql> select * from AddressBook;
+----+------------+-----------+--------------------------+-----------+-------------+--------+--------------+----------------------------+
| id | first_name | last_name | address                  | city      | state       | zip    | phone_number | email                      |
+----+------------+-----------+--------------------------+-----------+-------------+--------+--------------+----------------------------+
|  1 | Harshal    | Gotarne   | Anik Village, Chembur    | Mumbai    | Maharashtra | 400074 | 8433878127   | harshalgotarne25@gmail.com |
|  2 | Nitish     | Prajapati | Sector 21                | Ulve      | Maharashtra | 410216 | 7652079588   | nitishprajapati@gmail.com  |
|  3 | Gaurav     | Dhande    | Jay ashtavinyak building | Dombivali | Maharashtra | 421202 | 7977139767   | gauravdhande@gmail.com     |
|  4 | Anjali     | Patel     | 23 Marine Drive          | Mumbai    | Maharashtra | 400020 | 02267890123  | anjali.patel@example.com   |
+----+------------+-----------+--------------------------+-----------+-------------+--------+--------------+----------------------------+
4 rows in set (0.00 sec)

----------------------------------------------------------------------------------------
UC4 : Edit existing contact using person name

mysql> UPDATE AddressBook
    -> SET email = 'anjalipatel@gmail.com'
    -> WHERE first_name = 'Anjali' AND last_name = 'Patel';
Query OK, 1 row affected (0.01 sec)
Rows matched: 1  Changed: 1  Warnings: 0

mysql> UPDATE AddressBook
    -> SET phone_number = '1234567890'
    -> WHERE first_name = 'Nitish' AND last_name = 'Prajapati';
Query OK, 1 row affected (0.01 sec)
Rows matched: 1  Changed: 1  Warnings: 0

----------------------------------------------------------------------------------------
UC5 : Delete a persons contact using persons name

mysql> DELETE FROM AddressBook
    -> WHERE first_name = 'Anjali' AND last_name = 'Patel';
Query OK, 1 row affected (0.01 sec)

mysql> select * from AddressBook;
+----+------------+-----------+--------------------------+-----------+-------------+--------+--------------+----------------------------+
| id | first_name | last_name | address                  | city      | state       | zip    | phone_number | email                      |
+----+------------+-----------+--------------------------+-----------+-------------+--------+--------------+----------------------------+
|  1 | Harshal    | Gotarne   | Anik Village, Chembur    | Mumbai    | Maharashtra | 400074 | 8433878127   | harshalgotarne25@gmail.com |
|  2 | Nitish     | Prajapati | Sector 21                | Ulve      | Maharashtra | 410216 | 1234567890   | nitishprajapati@gmail.com  |
|  3 | Gaurav     | Dhande    | Jay ashtavinyak building | Dombivali | Maharashtra | 421202 | 7977139767   | gauravdhande@gmail.com     |
+----+------------+-----------+--------------------------+-----------+-------------+--------+--------------+----------------------------+
3 rows in set (0.00 sec)

----------------------------------------------------------------------------------------
UC6 : Retrieve persons belonging using state or city

mysql> SELECT * FROM AddressBook
    -> WHERE city = 'Mumbai';
+----+------------+-----------+-----------------------+--------+-------------+--------+--------------+----------------------------+
| id | first_name | last_name | address               | city   | state       | zip    | phone_number | email                      |
+----+------------+-----------+-----------------------+--------+-------------+--------+--------------+----------------------------+
|  1 | Harshal    | Gotarne   | Anik Village, Chembur | Mumbai | Maharashtra | 400074 | 8433878127   | harshalgotarne25@gmail.com |
+----+------------+-----------+-----------------------+--------+-------------+--------+--------------+----------------------------+
1 row in set (0.00 sec)

mysql> SELECT * FROM AddressBook
    -> WHERE state = 'Maharashtra';
+----+------------+-----------+--------------------------+-----------+-------------+--------+--------------+----------------------------+
| id | first_name | last_name | address                  | city      | state       | zip    | phone_number | email                      |
+----+------------+-----------+--------------------------+-----------+-------------+--------+--------------+----------------------------+
|  1 | Harshal    | Gotarne   | Anik Village, Chembur    | Mumbai    | Maharashtra | 400074 | 8433878127   | harshalgotarne25@gmail.com |
|  2 | Nitish     | Prajapati | Sector 21                | Ulve      | Maharashtra | 410216 | 1234567890   | nitishprajapati@gmail.com  |
|  3 | Gaurav     | Dhande    | Jay ashtavinyak building | Dombivali | Maharashtra | 421202 | 7977139767   | gauravdhande@gmail.com     |
+----+------------+-----------+--------------------------+-----------+-------------+--------+--------------+----------------------------+
3 rows in set (0.00 sec)

----------------------------------------------------------------------------------------
UC7 : Group by city or state


mysql> SELECT city, COUNT(*) AS number_of_contacts
    -> FROM AddressBook
    -> GROUP BY city;
+-----------+--------------------+
| city      | number_of_contacts |
+-----------+--------------------+
| Mumbai    |                  1 |
| Ulve      |                  1 |
| Dombivali |                  1 |
+-----------+--------------------+
3 rows in set (0.01 sec)

mysql> SELECT state, COUNT(*) AS number_of_contacts
    -> FROM AddressBook
    -> GROUP BY state;
+-------------+--------------------+
| state       | number_of_contacts |
+-------------+--------------------+
| Maharashtra |                  3 |
+-------------+--------------------+
1 row in set (0.00 sec)

----------------------------------------------------------------------------------------
UC8 : Sort alphabetically by city name


mysql> SELECT * FROM AddressBook
    -> WHERE city = 'Mumbai'
    -> ORDER BY last_name ASC, first_name ASC;
+----+------------+-----------+-----------------------+--------+-------------+--------+--------------+----------------------------+
| id | first_name | last_name | address               | city   | state       | zip    | phone_number | email                      |
+----+------------+-----------+-----------------------+--------+-------------+--------+--------------+----------------------------+
|  1 | Harshal    | Gotarne   | Anik Village, Chembur | Mumbai | Maharashtra | 400074 | 8433878127   | harshalgotarne25@gmail.com |
|  5 | Amruta     | Shinde    | Sion                  | Mumbai | Maharashtra | 400017 | 1234567890   | amrutashinde@gmail.com     |
+----+------------+-----------+-----------------------+--------+-------------+--------+--------------+----------------------------+
2 rows in set (0.00 sec)

mysql> SELECT * FROM AddressBook
    -> WHERE city = 'Mumbai'
    -> ORDER BY first_name ASC, last_name ASC;
+----+------------+-----------+-----------------------+--------+-------------+--------+--------------+----------------------------+
| id | first_name | last_name | address               | city   | state       | zip    | phone_number | email                      |
+----+------------+-----------+-----------------------+--------+-------------+--------+--------------+----------------------------+
|  5 | Amruta     | Shinde    | Sion                  | Mumbai | Maharashtra | 400017 | 1234567890   | amrutashinde@gmail.com     |
|  1 | Harshal    | Gotarne   | Anik Village, Chembur | Mumbai | Maharashtra | 400074 | 8433878127   | harshalgotarne25@gmail.com |
+----+------------+-----------+-----------------------+--------+-------------+--------+--------------+----------------------------+
2 rows in set (0.00 sec)

----------------------------------------------------------------------------------------
UC9 : Identify each contact with name and type


mysql> create table address_book_type
    -> (
    -> ID int AUTO_INCREMENT PRIMARY KEY,
    -> name VARCHAR(30) not null,
    -> type VARCHAR(30) not null
    -> );
Query OK, 0 rows affected (0.05 sec)

mysql> insert into address_book_type (name, type) values
    -> ('Family Contacts', 'Family'),
    -> ('Professional Contacts', 'Professional'),
    -> ('Friends Contact','Friends');
Query OK, 3 rows affected (0.00 sec)
Records: 3  Duplicates: 0  Warnings: 0

mysql> select * from address_book_type;
+----+-----------------------+--------------+
| ID | name                  | type         |
+----+-----------------------+--------------+
|  1 | Family Contacts       | Family       |
|  2 | Professional Contacts | Professional |
|  3 | Friends Contact       | Friends      |
+----+-----------------------+--------------+
3 rows in set (0.00 sec)

mysql> alter table AddressBook
    -> add column type int(1),
    -> add foreign key(type) references address_book_type(ID);
Query OK, 4 rows affected, 1 warning (0.10 sec)
Records: 4  Duplicates: 0  Warnings: 1

mysql> update AddressBook set type = 1 where first_name = 'Harshal';
Query OK, 1 row affected (0.01 sec)
Rows matched: 1  Changed: 1  Warnings: 0

mysql> update AddressBook set type = 2 where first_name = 'Nitish';
Query OK, 1 row affected (0.00 sec)
Rows matched: 1  Changed: 1  Warnings: 0

mysql> update AddressBook set type = 2 where first_name = 'Gaurav';
Query OK, 1 row affected (0.01 sec)
Rows matched: 1  Changed: 1  Warnings: 0

mysql> update AddressBook set type = 3 where first_name = 'Amruta';
Query OK, 1 row affected (0.00 sec)
Rows matched: 1  Changed: 1  Warnings: 0

mysql> select * from AddressBook;
+----+------------+-----------+--------------------------+-----------+-------------+--------+--------------+----------------------------+------+
| id | first_name | last_name | address                  | city      | state       | zip    | phone_number | email                      | type |
+----+------------+-----------+--------------------------+-----------+-------------+--------+--------------+----------------------------+------+
|  1 | Harshal    | Gotarne   | Anik Village, Chembur    | Mumbai    | Maharashtra | 400074 | 8433878127   | harshalgotarne25@gmail.com |    1 |
|  2 | Nitish     | Prajapati | Sector 21                | Ulve      | Maharashtra | 410216 | 1234567890   | nitishprajapati@gmail.com  |    2 |
|  3 | Gaurav     | Dhande    | Jay ashtavinyak building | Dombivali | Maharashtra | 421202 | 7977139767   | gauravdhande@gmail.com     |    2 |
|  5 | Amruta     | Shinde    | Sion                     | Mumbai    | Maharashtra | 400017 | 1234567890   | amrutashinde@gmail.com     |    3 |
+----+------------+-----------+--------------------------+-----------+-------------+--------+--------------+----------------------------+------+
4 rows in set (0.00 sec)

----------------------------------------------------------------------------------------
UC10 : Ability to get number of contact persons by type and count them


mysql> select type, count(type) from AddressBook group by type;
+------+-------------+
| type | count(type) |
+------+-------------+
|    1 |           1 |
|    2 |           2 |
|    3 |           1 |
+------+-------------+
3 rows in set (0.01 sec)

mysql> select * from address_book_type;
+----+-----------------------+--------------+
| ID | name                  | type         |
+----+-----------------------+--------------+
|  1 | Family Contacts       | Family       |
|  2 | Professional Contacts | Professional |
|  3 | Friends Contact       | Friends      |
+----+-----------------------+--------------+
3 rows in set (0.02 sec)

----------------------------------------------------------------------------------------
UC11 : Ability to add a person to both friend and family


mysql> INSERT INTO AddressBook (first_name,last_name,address,city,state,zip,phone_number,email,type) VALUES ('Aaron','Joseph',"Anik Village","Mumbai
","Maharashtra",400074,9167328904,"aaronjoseph@gmail.com","3");
Query OK, 1 row affected (0.01 sec)

mysql> INSERT INTO AddressBook (first_name,last_name,address,city,state,zip,phone_number,email,type) VALUES ('Aaron','Joseph',"Anik Village","Mumbai","Maharashtra",400074,9167328904,"aaronjoseph@gmail.com","1");
Query OK, 1 row affected (0.01 sec)

mysql> select * from AddressBook;
+----+------------+-----------+--------------------------+-----------+-------------+--------+--------------+----------------------------+------+
| id | first_name | last_name | address                  | city      | state       | zip    | phone_number | email                      | type |
+----+------------+-----------+--------------------------+-----------+-------------+--------+--------------+----------------------------+------+
|  1 | Harshal    | Gotarne   | Anik Village, Chembur    | Mumbai    | Maharashtra | 400074 | 8433878127   | harshalgotarne25@gmail.com |    1 |
|  2 | Nitish     | Prajapati | Sector 21                | Ulve      | Maharashtra | 410216 | 1234567890   | nitishprajapati@gmail.com  |    2 |
|  3 | Gaurav     | Dhande    | Jay ashtavinyak building | Dombivali | Maharashtra | 421202 | 7977139767   | gauravdhande@gmail.com     |    2 |
|  5 | Amruta     | Shinde    | Sion                     | Mumbai    | Maharashtra | 400017 | 1234567890   | amrutashinde@gmail.com     |    3 |
|  6 | Aaron      | Joseph    | Anik Village             | Mumbai    | Maharashtra | 400074 | 9167328904   | aaronjoseph@gmail.com      |    3 |
|  7 | Aaron      | Joseph    | Anik Village             | Mumbai    | Maharashtra | 400074 | 9167328904   | aaronjoseph@gmail.com      |    1 |
+----+------------+-----------+--------------------------+-----------+-------------+--------+--------------+----------------------------+------+
6 rows in set (0.00 sec)
